{
  "version": "v4",
  "repo": "DefinitelyTyped/DefinitelyTyped",
  "ref": "master",
  "path": "typings",
  "bundle": "typings/tsd.d.ts",
  "installed": {
    "bootstrap/bootstrap.d.ts": {
      "commit": "0545e0567d242abcd295a63babb86c88e7d9911d"
    },
    "jquery/jquery.d.ts": {
      "commit": "0545e0567d242abcd295a63babb86c88e7d9911d"
    }
  }
}
