{
  "version": "v4",
  "repo": "borisyankov/DefinitelyTyped",
  "ref": "master",
  "path": "typings",
  "bundle": "typings/tsd.d.ts",
  "installed": {
    "_debugger/_debugger.d.ts": {
      "commit": "5937bdd91a0f45a6d4c2f8a5692990fbce573764"
    },
    "node/node.d.ts": {
      "commit": "d2bab5738b84b91d8ee18a68c7b379a9714cf82f"
    }
  }
}
